{
  "date": "2026-09-19",
  "generated_at": "2026-09-19T05:17:52+02:00",
  "headline": "11 interesting things surfaced from HN on 2026-09-19",
  "id": "2026-09-19",
  "mention_ids": [
    "2026-09-19:ruby-landlock:49749656",
    "2026-09-19:pangolin:49754785",
    "2026-09-19:openziti:49754785",
    "2026-09-19:mercury-2-5:49752041",
    "2026-09-19:costgoat:49747925",
    "2026-09-19:jemalloc:49750152",
    "2026-09-19:fex:49750094",
    "2026-09-19:foqos:49749369",
    "2026-09-19:olauncher:49749369",
    "2026-09-19:undefined-behavior-what-happened-to-my-code:49746406",
    "2026-09-19:analysis-i-by-terence-tao:49755024"
  ],
  "summary": {
    "items_surfaced": 11,
    "stories_attempted": null,
    "stories_processed": null
  }
}
