{
  "date": "2026-08-04",
  "generated_at": "2026-08-04T05:17:18+02:00",
  "headline": "10 interesting things surfaced from HN on 2026-08-04",
  "id": "2026-08-04",
  "mention_ids": [
    "2026-08-04:artificial-intelligence-natural-stupidity:49151933",
    "2026-08-04:bonsai:49152842",
    "2026-08-04:isopolis:49149966",
    "2026-08-04:floor796:49149966",
    "2026-08-04:smalldocs:49153374",
    "2026-08-04:rspamd:49153361",
    "2026-08-04:c-kermit:49158474",
    "2026-08-04:signals-and-threads-building-a-ui-framework:49152842",
    "2026-08-04:colatura-di-alici:49125168",
    "2026-08-04:a-handwritten-blogging-platform:49119751"
  ],
  "summary": {
    "items_surfaced": 10,
    "stories_attempted": null,
    "stories_processed": null
  }
}
