{
  "date": "2026-09-22",
  "generated_at": "2026-09-22T05:18:06+02:00",
  "headline": "11 interesting things surfaced from HN on 2026-09-22",
  "id": "2026-09-22",
  "mention_ids": [
    "2026-09-22:selfcontrol:49787726",
    "2026-09-22:bazel:49792067",
    "2026-09-22:mini-agi:49783133",
    "2026-09-22:pyodide:49787142",
    "2026-09-22:dflash-2:49787313",
    "2026-09-22:deepseek-v4-1-flash:49789224",
    "2026-09-22:the-illustrated-transformer:49792342",
    "2026-09-22:hermes-radio:49789228",
    "2026-09-22:the-intercept-snowden-archive:49780820",
    "2026-09-22:grim-fandango-remastered:49783495",
    "2026-09-22:ogre-battle-64-person-of-lordly-caliber:49780022"
  ],
  "summary": {
    "items_surfaced": 11,
    "stories_attempted": null,
    "stories_processed": null
  }
}
