{
  "date": "2026-08-25",
  "generated_at": "2026-08-25T05:17:43+02:00",
  "headline": "12 interesting things surfaced from HN on 2026-08-25",
  "id": "2026-08-25",
  "mention_ids": [
    "2026-08-25:metapad:49421158",
    "2026-08-25:sqlite-virtual-tables:49415271",
    "2026-08-25:steampipe:49415271",
    "2026-08-25:comfyui:49421158",
    "2026-08-25:lineageos:49415621",
    "2026-08-25:ai-chip-architectures:49405657",
    "2026-08-25:geekerwan-s-xiaomi-xring-o2-review:49420873",
    "2026-08-25:san-francisco-in-unity:49422784",
    "2026-08-25:watch-dogs-2:49422784",
    "2026-08-25:ejabberd:49421536",
    "2026-08-25:fluux-messenger:49421536",
    "2026-08-25:epiforecasts-ebola-outbreak-tracker:49416097"
  ],
  "summary": {
    "items_surfaced": 12,
    "stories_attempted": null,
    "stories_processed": null
  }
}
